{"$schema":"https://json-schema.org/draft/2020-12/schema","type":"object","additionalProperties":false,"required":["schema_version","artifact_id","stage","status","required_route","adjudicator_identity","adjudicator_role","independence_attestation","sealed_primary_review_sha256","sealed_inputs_sha256","rows"],"properties":{"schema_version":{"const":"ground_claim_adjudication_v1.0.0"},"artifact_id":{"const":"ground-claim-adjudication-v1"},"stage":{"const":"independent_adjudication"},"status":{"const":"not_started"},"required_route":{"const":"fresh_sol_high"},"adjudicator_identity":{"type":"null"},"adjudicator_role":{"type":"null"},"independence_attestation":{"type":"null"},"sealed_primary_review_sha256":{"type":"string","pattern":"^[a-f0-9]{64}$"},"sealed_inputs_sha256":{"type":"string","pattern":"^[a-f0-9]{64}$"},"rows":{"type":"array","maxItems":0}}}
